{
  "schema_version": "0.1.0",
  "run_id": "RUN-OFS001-PILOT-003",
  "monitor_id": "MON-MEMORY-001",
  "evaluated_at": "2026-08-23T17:52:41.930353Z",
  "coverage_status": "met-declared-scope",
  "monitor_snapshot_match": true,
  "expected": {
    "query_families": [
      "AI for Science memory architecture",
      "CXL memory pooling HPC performance overhead negative results",
      "HBM CXL memory pooling tiered memory",
      "HBM4 power efficiency independent measurement limitations",
      "HPC memory hierarchy roadmap",
      "emerging memory HPC"
    ],
    "coverage_queries": [
      "AI for Science memory architecture",
      "HBM CXL memory pooling tiered memory",
      "HPC memory hierarchy roadmap",
      "emerging memory HPC"
    ],
    "falsification_queries": [
      "CXL memory pooling HPC performance overhead negative results",
      "HBM4 power efficiency independent measurement limitations"
    ],
    "source_class_requirements": [
      {
        "requirement_id": "authoritative-primary",
        "one_of": [
          "official-primary",
          "standards-body",
          "vendor-primary",
          "research-primary"
        ],
        "minimum_count": 2
      },
      {
        "requirement_id": "independent-technical",
        "one_of": [
          "peer-reviewed-research",
          "independent-analysis"
        ],
        "minimum_count": 2
      },
      {
        "requirement_id": "independent-analysis",
        "one_of": [
          "independent-analysis"
        ],
        "minimum_count": 1
      }
    ],
    "languages": [
      "en",
      "ja"
    ],
    "minimum_sources_per_query": 1,
    "minimum_total_sources": 8,
    "minimum_origin_groups": 6
  },
  "observed": {
    "source_count": 13,
    "primary_source_count": 10,
    "origin_group_count": 13,
    "query_families": [
      "AI for Science memory architecture",
      "CXL memory pooling HPC performance overhead negative results",
      "HBM CXL memory pooling tiered memory",
      "HBM4 power efficiency independent measurement limitations",
      "HPC memory hierarchy roadmap",
      "emerging memory HPC"
    ],
    "query_source_counts": {
      "AI for Science memory architecture": 2,
      "CXL memory pooling HPC performance overhead negative results": 2,
      "HBM CXL memory pooling tiered memory": 2,
      "HBM4 power efficiency independent measurement limitations": 3,
      "HPC memory hierarchy roadmap": 2,
      "emerging memory HPC": 2
    },
    "source_classes": [
      "independent-analysis",
      "official-primary",
      "peer-reviewed-research",
      "research-primary",
      "standards-body",
      "vendor-primary"
    ],
    "source_class_requirement_results": [
      {
        "requirement_id": "authoritative-primary",
        "one_of": [
          "official-primary",
          "standards-body",
          "vendor-primary",
          "research-primary"
        ],
        "minimum_count": 2,
        "observed_count": 7,
        "met": true
      },
      {
        "requirement_id": "independent-technical",
        "one_of": [
          "peer-reviewed-research",
          "independent-analysis"
        ],
        "minimum_count": 2,
        "observed_count": 6,
        "met": true
      },
      {
        "requirement_id": "independent-analysis",
        "one_of": [
          "independent-analysis"
        ],
        "minimum_count": 1,
        "observed_count": 3,
        "met": true
      }
    ],
    "languages": [
      "en",
      "ja"
    ],
    "rights_decisions": {
      "evidence-excerpt": 12,
      "metadata-only": 1
    },
    "query_warnings": [
      {
        "kind": "rights-excluded",
        "detail": "The prior TrendForce result was retained as metadata only; an openly processable replacement was selected."
      }
    ]
  },
  "gaps": {
    "missing_queries": [],
    "below_minimum_queries": [],
    "missing_source_requirements": [],
    "missing_languages": [],
    "minimum_total_sources": [],
    "minimum_origin_groups": [],
    "duplicate_source_selections": [],
    "query_failures": []
  },
  "caveat": "This status measures only the declared Monitor scope. It never means that the Web or the research domain was searched completely."
}
