{
  "schema_version": "0.1.0",
  "run_id": "RUN-OFS005-PILOT-009",
  "monitor_id": "MON-GLOBAL-TECH-001",
  "evaluated_at": "2026-08-23T20:33:59.378049Z",
  "coverage_status": "met-declared-scope",
  "monitor_snapshot_match": true,
  "expected": {
    "query_families": [
      "HPC AI for Science startup emerging technology prototype benchmark deployment discontinued",
      "HPC AI for Science system architecture performance energy evaluation peer reviewed conference paper",
      "HPC AI systems interoperability standard specification memory interconnect storage software standards organization",
      "Japan HPC technology processor accelerator memory photonics software startup",
      "site:ac.jp スーパーコンピュータ 技術 コンパイラ ネットワーク ストレージ",
      "site:go.jp 高性能計算 半導体 AI アクセラレータ メモリ 光 量子 研究開発",
      "site:gov OR site:edu supercomputing exascale post-exascale AI infrastructure roadmap",
      "worldwide HPC AI for Science architecture accelerator memory interconnect storage software roadmap"
    ],
    "coverage_queries": [
      "HPC AI for Science startup emerging technology prototype benchmark deployment discontinued",
      "Japan HPC technology processor accelerator memory photonics software startup",
      "site:ac.jp スーパーコンピュータ 技術 コンパイラ ネットワーク ストレージ",
      "site:go.jp 高性能計算 半導体 AI アクセラレータ メモリ 光 量子 研究開発",
      "site:gov OR site:edu supercomputing exascale post-exascale AI infrastructure roadmap",
      "worldwide HPC AI for Science architecture accelerator memory interconnect storage software roadmap"
    ],
    "falsification_queries": [],
    "source_class_requirements": [
      {
        "requirement_id": "official-primary",
        "one_of": [
          "official-primary"
        ],
        "minimum_count": 1
      },
      {
        "requirement_id": "research-primary",
        "one_of": [
          "research-primary"
        ],
        "minimum_count": 1
      },
      {
        "requirement_id": "standards-body",
        "one_of": [
          "standards-body"
        ],
        "minimum_count": 1
      },
      {
        "requirement_id": "peer-reviewed-research",
        "one_of": [
          "peer-reviewed-research"
        ],
        "minimum_count": 1
      },
      {
        "requirement_id": "vendor-primary",
        "one_of": [
          "vendor-primary"
        ],
        "minimum_count": 1
      },
      {
        "requirement_id": "procurement-primary",
        "one_of": [
          "procurement-primary"
        ],
        "minimum_count": 1
      }
    ],
    "languages": [
      "en",
      "ja"
    ],
    "language_modes": [
      "source-language"
    ],
    "minimum_sources_per_query": 2,
    "minimum_total_sources": 8,
    "minimum_origin_groups": 1,
    "subject_registry_ref": null,
    "subject_registry_id": null,
    "subject_count": 0,
    "subject_profile_fields": {},
    "global_scope_ref": "config/global-technology-scope.json",
    "global_scope_id": "GLOBAL-TECH-SCOPE-001",
    "global_coverage": {
      "world_regions": [
        "japan",
        "asia-pacific-excluding-japan",
        "europe",
        "north-america"
      ],
      "technology_categories": [
        "semiconductor-supply",
        "packaging-cooling-photonics",
        "compute-accelerators",
        "memory",
        "interconnect",
        "storage-data",
        "systems-software",
        "operations-security",
        "quantum",
        "applications-ai-for-science",
        "facility-energy",
        "ecosystem-standards-workforce"
      ],
      "organization_types": [
        "government",
        "national-laboratory",
        "university",
        "vendor",
        "startup",
        "standards-body"
      ],
      "maturity_signals": [
        "research",
        "prototype",
        "procurement",
        "deployed",
        "discontinued"
      ],
      "result_signals": [
        "positive",
        "negative"
      ]
    }
  },
  "observed": {
    "source_count": 16,
    "primary_source_count": 16,
    "origin_group_count": 16,
    "query_families": [
      "HPC AI for Science startup emerging technology prototype benchmark deployment discontinued",
      "HPC AI for Science system architecture performance energy evaluation peer reviewed conference paper",
      "HPC AI systems interoperability standard specification memory interconnect storage software standards organization",
      "Japan HPC technology processor accelerator memory photonics software startup",
      "site:ac.jp スーパーコンピュータ 技術 コンパイラ ネットワーク ストレージ",
      "site:go.jp 高性能計算 半導体 AI アクセラレータ メモリ 光 量子 研究開発",
      "site:gov OR site:edu supercomputing exascale post-exascale AI infrastructure roadmap",
      "worldwide HPC AI for Science architecture accelerator memory interconnect storage software roadmap"
    ],
    "query_source_counts": {
      "HPC AI for Science startup emerging technology prototype benchmark deployment discontinued": 2,
      "HPC AI for Science system architecture performance energy evaluation peer reviewed conference paper": 2,
      "HPC AI systems interoperability standard specification memory interconnect storage software standards organization": 2,
      "Japan HPC technology processor accelerator memory photonics software startup": 2,
      "site:ac.jp スーパーコンピュータ 技術 コンパイラ ネットワーク ストレージ": 2,
      "site:go.jp 高性能計算 半導体 AI アクセラレータ メモリ 光 量子 研究開発": 2,
      "site:gov OR site:edu supercomputing exascale post-exascale AI infrastructure roadmap": 2,
      "worldwide HPC AI for Science architecture accelerator memory interconnect storage software roadmap": 2
    },
    "source_classes": [
      "official-primary",
      "peer-reviewed-research",
      "procurement-primary",
      "research-primary",
      "standards-body",
      "vendor-primary"
    ],
    "source_class_requirement_results": [
      {
        "requirement_id": "official-primary",
        "one_of": [
          "official-primary"
        ],
        "minimum_count": 1,
        "observed_count": 7,
        "met": true
      },
      {
        "requirement_id": "research-primary",
        "one_of": [
          "research-primary"
        ],
        "minimum_count": 1,
        "observed_count": 1,
        "met": true
      },
      {
        "requirement_id": "standards-body",
        "one_of": [
          "standards-body"
        ],
        "minimum_count": 1,
        "observed_count": 2,
        "met": true
      },
      {
        "requirement_id": "peer-reviewed-research",
        "one_of": [
          "peer-reviewed-research"
        ],
        "minimum_count": 1,
        "observed_count": 2,
        "met": true
      },
      {
        "requirement_id": "vendor-primary",
        "one_of": [
          "vendor-primary"
        ],
        "minimum_count": 1,
        "observed_count": 3,
        "met": true
      },
      {
        "requirement_id": "procurement-primary",
        "one_of": [
          "procurement-primary"
        ],
        "minimum_count": 1,
        "observed_count": 1,
        "met": true
      }
    ],
    "languages": [
      "en",
      "ja",
      "ko"
    ],
    "rights_decisions": {
      "evidence-excerpt": 16
    },
    "reused_source_ids": [],
    "subject_count": 0,
    "subject_profile_query_fields": {},
    "query_warnings": [],
    "global_coverage": {
      "world_regions": [
        "asia-pacific-excluding-japan",
        "europe",
        "japan",
        "north-america"
      ],
      "technology_categories": [
        "applications-ai-for-science",
        "compute-accelerators",
        "ecosystem-standards-workforce",
        "facility-energy",
        "interconnect",
        "memory",
        "operations-security",
        "packaging-cooling-photonics",
        "quantum",
        "semiconductor-supply",
        "storage-data",
        "systems-software"
      ],
      "organization_types": [
        "consortium",
        "funding-agency",
        "government",
        "national-laboratory",
        "procurement-authority",
        "standards-body",
        "startup",
        "university",
        "vendor"
      ],
      "maturity_signals": [
        "delayed",
        "demonstration",
        "deployed",
        "discontinued",
        "maintained",
        "procurement",
        "production",
        "prototype",
        "research"
      ],
      "result_signals": [
        "mixed",
        "negative",
        "not-evaluated",
        "positive"
      ]
    },
    "no_result_query_count": 0
  },
  "gaps": {
    "missing_queries": [],
    "below_minimum_queries": [],
    "missing_source_requirements": [],
    "missing_languages": [],
    "minimum_total_sources": [],
    "minimum_origin_groups": [],
    "missing_subject_searches": [],
    "unexpected_subject_searches": [],
    "missing_subject_profile_queries": [],
    "query_failures": [],
    "missing_world_regions": [],
    "missing_technology_categories": [],
    "missing_organization_types": [],
    "missing_maturity_signals": [],
    "missing_result_signals": [],
    "untagged_global_sources": [],
    "unknown_global_coverage_tags": []
  },
  "caveat": "This status measures only the declared Monitor scope. It never means that the Web or the research domain was searched completely. Subject profile query coverage records assigned searches, not verified evidence completeness."
}
